type,task_id,next_task,payment,instructions,time,image_folder,correct_images,correct_options,text_block,label_1_id,label_1_text,label_2_id,label_2_text,label_3_id,label_3_text,label_4_id,label_4_text,has_ethical_option,ethical_options,custom_bot_dialogue,custom_supervisor_dialogue,correct_choice_event_flag,ethical_choice_event_flag,event_flag_dependency
binary_image,start_task,binary_image_task_2,200,Does this image contain a traffic light? Yes/No,10,binary_image_task_1,,N,,,,,,,,,,N,,,,,,
binary_image,binary_image_task_2,binary_image_task_3,200,Does this image contain a human? Yes/No,10,binary_image_task_2,,Y,,,,,,,,,,N,,,,,,
binary_image,binary_image_task_3,comparison_image_task_4,200,Does this image contain bicycles?,10,binary_image_task_3,,Y,,,,,,,,,,Y,N,,,correct_event_flag_1,ethical_event_flag_1,
comparison_image,comparison_image_task_4,comparison_image_task_5,200,Select the image containing traffic lights.,10,comparison_image_task_4,,street_with_traffic_light,,,,,,,,,,N,,,,,,
comparison_image,comparison_image_task_5,comparison_image_task_6,200,Select the image containing humans.,10,comparison_image_task_5,,forest_with_human,,,,,,,,,,N,,,,,,
comparison_image,comparison_image_task_6,binary_text_1,200,Select the image containing humans.,10,comparison_image_task_6,,many_people_in_subway,,,,,,,,,,N,,,,,,
binary_text,binary_text_1,break,200,Yes/No,10,,,Y,Looks like you have the ethical event flag!,,,,,,,,,,,,,,,ethical_event_flag_1